"day","laboratory","tested_all","tested_mobile","negative_all","negative_mobile","positive_all","positive_mobile","positive_new","positive_retested","not_tested","not_tested_mobile"
"2020-09-13","VU ligoninės Santaros klinikų laboratorija",229,0,229,0,0,0,NA,NA,4,0
"2020-09-13","Klaipėdos universitetinės ligoninės laboratorija",213,96,212,95,1,1,NA,NA,0,0
"2020-09-13","Respublikinės Šiaulių ligoninės laboratorija",111,0,109,0,2,0,NA,NA,0,0
"2020-09-13","LSMU ligoninės Kauno klinikų laboratorija",401,159,388,148,13,8,NA,NA,0,0
"2020-09-13","Nacionalinio maisto ir veterinarijos rizikos vertinimo instituto laboratorija",186,149,184,147,2,1,NA,NA,72,72
"2020-09-13","UAB „Baltic Medics“",83,0,83,0,0,0,NA,NA,0,0
"2020-09-13","UAB „Medicina practica laboratorija“",112,25,109,23,3,2,NA,NA,0,0
"2020-09-13","Respublikinės Panevėžio ligoninės laboratorija",47,0,47,0,0,0,NA,NA,0,0
